{
  "schema_version": "mni-protocol-compatibility.v0",
  "producer_fixture": "producer.example.v0.json",
  "consumer_fixture": "consumer.example.v0.json",
  "cases": [
    { "id": "baseline_exact_v0", "producer": [], "consumer": [], "expected": "accept", "diagnostic": "compatible", "enabled_capabilities": ["mni.entities.ephemeral.v0", "mni.geometry.surface_samples.v0"] },
    { "id": "newer_supported_minor", "producer": [{ "op": "set", "path": "protocol.minor", "value": 1 }], "consumer": [], "expected": "accept", "diagnostic": "compatible" },
    { "id": "newer_additive_minor_degrades", "producer": [{ "op": "set", "path": "protocol.minor", "value": 2 }], "consumer": [], "expected": "degraded", "diagnostic": "newer_protocol_minor" },
    { "id": "multiple_degradations_keep_diagnostics", "producer": [{ "op": "set", "path": "protocol.minor", "value": 2 }, { "op": "append", "path": "capabilities", "value": { "id": "mni.chat.rich_format.v1", "maturity": "stable" } }], "consumer": [], "expected": "degraded", "diagnostic": "optional_capability_unavailable", "diagnostics": ["optional_capability_unavailable", "newer_protocol_minor"] },
    { "id": "major_mismatch_fails_closed", "producer": [{ "op": "set", "path": "protocol.major", "value": 2 }], "consumer": [], "expected": "reject", "diagnostic": "protocol_major_mismatch" },
    { "id": "observation_v0_to_v1_rejected", "producer": [{ "op": "set", "path": "schemas.observation", "value": "observation.v1" }], "consumer": [], "expected": "reject", "diagnostic": "unsupported_observation_schema" },
    { "id": "action_request_v0_to_v1_rejected", "producer": [{ "op": "set", "path": "schemas.action_request", "value": "action-request.v1" }], "consumer": [], "expected": "reject", "diagnostic": "unsupported_action_request_schema" },
    { "id": "action_outcome_v0_to_v1_rejected", "producer": [{ "op": "set", "path": "schemas.action_outcome", "value": "action-outcome.v1" }], "consumer": [], "expected": "reject", "diagnostic": "unsupported_action_outcome_schema" },
    { "id": "unsupported_minecraft_version_rejected", "producer": [{ "op": "set", "path": "environment.minecraft_version", "value": "26.4" }], "consumer": [], "expected": "reject", "diagnostic": "unsupported_minecraft_version" },
    { "id": "unsupported_java_version_rejected", "producer": [{ "op": "set", "path": "environment.java_major", "value": 21 }], "consumer": [], "expected": "reject", "diagnostic": "unsupported_java_version" },
    { "id": "unsupported_loader_version_rejected", "producer": [{ "op": "set", "path": "environment.loader_version", "value": "0.21.0" }], "consumer": [], "expected": "reject", "diagnostic": "unsupported_loader_version" },
    { "id": "unsupported_mod_version_rejected", "producer": [{ "op": "set", "path": "environment.mod_version", "value": "0.2.0" }], "consumer": [], "expected": "reject", "diagnostic": "unsupported_mod_version" },
    { "id": "unknown_optional_capability_degrades", "producer": [{ "op": "append", "path": "capabilities", "value": { "id": "mni.chat.rich_format.v1", "maturity": "stable" } }], "consumer": [], "expected": "degraded", "diagnostic": "optional_capability_unavailable", "enabled_capabilities": ["mni.entities.ephemeral.v0", "mni.geometry.surface_samples.v0"] },
    { "id": "unknown_required_capability_rejected", "producer": [{ "op": "append", "path": "capabilities", "value": { "id": "mni.actions.ritual.v9", "maturity": "stable" } }, { "op": "append", "path": "required_capabilities", "value": "mni.actions.ritual.v9" }], "consumer": [], "expected": "reject", "diagnostic": "required_capability_unsupported" },
    { "id": "experimental_optional_capability_degrades", "producer": [{ "op": "append", "path": "capabilities", "value": { "id": "mni.actions.cancellation.v0", "maturity": "experimental" } }], "consumer": [], "expected": "degraded", "diagnostic": "experimental_capability_omitted", "enabled_capabilities": ["mni.entities.ephemeral.v0", "mni.geometry.surface_samples.v0"] },
    { "id": "allowlisted_experimental_capability_degrades", "producer": [{ "op": "append", "path": "capabilities", "value": { "id": "mni.actions.cancellation.v0", "maturity": "experimental" } }], "consumer": [{ "op": "append", "path": "allowed_experimental_capabilities", "value": "mni.actions.cancellation.v0" }], "expected": "degraded", "diagnostic": "experimental_capability_enabled", "enabled_capabilities": ["mni.actions.cancellation.v0", "mni.entities.ephemeral.v0", "mni.geometry.surface_samples.v0"] },
    { "id": "required_experimental_capability_rejected", "producer": [{ "op": "append", "path": "capabilities", "value": { "id": "mni.actions.cancellation.v0", "maturity": "experimental" } }, { "op": "append", "path": "required_capabilities", "value": "mni.actions.cancellation.v0" }], "consumer": [], "expected": "reject", "diagnostic": "required_experimental_capability_not_allowed" },
    { "id": "required_experimental_allowlisted_degrades", "producer": [{ "op": "append", "path": "capabilities", "value": { "id": "mni.actions.cancellation.v0", "maturity": "experimental" } }, { "op": "append", "path": "required_capabilities", "value": "mni.actions.cancellation.v0" }], "consumer": [{ "op": "append", "path": "allowed_experimental_capabilities", "value": "mni.actions.cancellation.v0" }], "expected": "degraded", "diagnostic": "experimental_capability_enabled", "enabled_capabilities": ["mni.actions.cancellation.v0", "mni.entities.ephemeral.v0", "mni.geometry.surface_samples.v0"] },
    { "id": "experimental_allowlist_does_not_enable_unknown_stable", "producer": [{ "op": "append", "path": "capabilities", "value": { "id": "mni.actions.ritual.v9", "maturity": "stable" } }, { "op": "append", "path": "required_capabilities", "value": "mni.actions.ritual.v9" }], "consumer": [{ "op": "append", "path": "allowed_experimental_capabilities", "value": "mni.actions.ritual.v9" }], "expected": "reject", "diagnostic": "required_capability_unsupported" },
    { "id": "unsupported_server_mode_rejected", "producer": [{ "op": "set", "path": "environment.server_mode", "value": "offline" }], "consumer": [], "expected": "reject", "diagnostic": "unsupported_server_mode" }
  ]
}
